{
  "schema": "workspace_hygiene_manifest_v1",
  "generated_utc": "2026-05-01T00:52:36Z",
  "mode": "audit_only",
  "workspace_root": "<WORKSPACE_ROOT>",
  "repo_root": "<REPO_ROOT>",
  "quarantine_root": "<QUARANTINE_ROOT>",
  "items": [
    {
      "path": "<WORKSPACE_ROOT>/.DS_Store",
      "classification": "desktop_metadata",
      "reason": "macOS metadata file. Ignore by default unless a human wants cosmetic cleanup.",
      "restore_target": "<WORKSPACE_ROOT>/.DS_Store",
      "decision_state": "ignore"
    },
    {
      "path": "<WORKSPACE_ROOT>/.idea",
      "classification": "workspace_metadata",
      "reason": "IDE workspace metadata outside the repo root. Keep unless a human explicitly retires the workspace.",
      "restore_target": "<WORKSPACE_ROOT>/.idea",
      "decision_state": "keep"
    },
    {
      "path": "<WORKSPACE_ROOT>/.pass_backups",
      "classification": "external_workspace_entry",
      "reason": "Top-level directory outside the active repo root. Keep only if still actively used; otherwise quarantine first.",
      "restore_target": "<WORKSPACE_ROOT>/.pass_backups",
      "decision_state": "quarantine_first"
    },
    {
      "path": "<WORKSPACE_ROOT>/adb_pull",
      "classification": "external_workspace_entry",
      "reason": "Top-level directory outside the active repo root. Keep only if still actively used; otherwise quarantine first.",
      "restore_target": "<WORKSPACE_ROOT>/adb_pull",
      "decision_state": "quarantine_first"
    },
    {
      "path": "<WORKSPACE_ROOT>/anthropic_closure_private",
      "classification": "external_workspace_entry",
      "reason": "Top-level directory outside the active repo root. Keep only if still actively used; otherwise quarantine first.",
      "restore_target": "<WORKSPACE_ROOT>/anthropic_closure_private",
      "decision_state": "quarantine_first"
    },
    {
      "path": "<WORKSPACE_ROOT>/chat_exports",
      "classification": "external_workspace_entry",
      "reason": "Top-level directory outside the active repo root. Keep only if still actively used; otherwise quarantine first.",
      "restore_target": "<WORKSPACE_ROOT>/chat_exports",
      "decision_state": "quarantine_first"
    },
    {
      "path": "<WORKSPACE_ROOT>/codex_chat_extract.py",
      "classification": "external_workspace_file",
      "reason": "Top-level file outside the active repo root. Quarantine first instead of deleting in place.",
      "restore_target": "<WORKSPACE_ROOT>/codex_chat_extract.py",
      "decision_state": "quarantine_first"
    },
    {
      "path": "<WORKSPACE_ROOT>/codex_chats_found.md",
      "classification": "external_workspace_file",
      "reason": "Top-level file outside the active repo root. Quarantine first instead of deleting in place.",
      "restore_target": "<WORKSPACE_ROOT>/codex_chats_found.md",
      "decision_state": "quarantine_first"
    },
    {
      "path": "<WORKSPACE_ROOT>/current_codex_chat_transcript.md",
      "classification": "external_workspace_file",
      "reason": "Top-level file outside the active repo root. Quarantine first instead of deleting in place.",
      "restore_target": "<WORKSPACE_ROOT>/current_codex_chat_transcript.md",
      "decision_state": "quarantine_first"
    },
    {
      "path": "<REPO_ROOT>",
      "classification": "project_repo",
      "reason": "Active main repository root; never quarantine or delete directly from workspace hygiene.",
      "restore_target": "<REPO_ROOT>",
      "decision_state": "keep"
    },
    {
      "path": "<WORKSPACE_ROOT>/mertformer_5080_native_challenge_builder_20260422_183127",
      "classification": "external_workspace_entry",
      "reason": "Top-level directory outside the active repo root. Keep only if still actively used; otherwise quarantine first.",
      "restore_target": "<WORKSPACE_ROOT>/mertformer_5080_native_challenge_builder_20260422_183127",
      "decision_state": "quarantine_first"
    },
    {
      "path": "<WORKSPACE_ROOT>/mertformer_5080_native_challenge_builder_20260422_183127.zip",
      "classification": "archive_or_dump",
      "reason": "Top-level archive or dump outside the main repo. Review and quarantine before any permanent cleanup.",
      "restore_target": "<WORKSPACE_ROOT>/mertformer_5080_native_challenge_builder_20260422_183127.zip",
      "decision_state": "quarantine_first"
    },
    {
      "path": "<WORKSPACE_ROOT>/mertformer_5080_native_challenge_builder_20260422_183127.zip.sha256",
      "classification": "external_workspace_file",
      "reason": "Top-level file outside the active repo root. Quarantine first instead of deleting in place.",
      "restore_target": "<WORKSPACE_ROOT>/mertformer_5080_native_challenge_builder_20260422_183127.zip.sha256",
      "decision_state": "quarantine_first"
    },
    {
      "path": "<WORKSPACE_ROOT>/mertformer_5080_native_challenge_builder_v2_20260422_183704",
      "classification": "external_workspace_entry",
      "reason": "Top-level directory outside the active repo root. Keep only if still actively used; otherwise quarantine first.",
      "restore_target": "<WORKSPACE_ROOT>/mertformer_5080_native_challenge_builder_v2_20260422_183704",
      "decision_state": "quarantine_first"
    },
    {
      "path": "<WORKSPACE_ROOT>/mertformer_5080_native_challenge_builder_v2_20260422_183704.zip",
      "classification": "archive_or_dump",
      "reason": "Top-level archive or dump outside the main repo. Review and quarantine before any permanent cleanup.",
      "restore_target": "<WORKSPACE_ROOT>/mertformer_5080_native_challenge_builder_v2_20260422_183704.zip",
      "decision_state": "quarantine_first"
    },
    {
      "path": "<WORKSPACE_ROOT>/mertformer_5080_native_challenge_builder_v2_20260422_183704.zip.sha256",
      "classification": "external_workspace_file",
      "reason": "Top-level file outside the active repo root. Quarantine first instead of deleting in place.",
      "restore_target": "<WORKSPACE_ROOT>/mertformer_5080_native_challenge_builder_v2_20260422_183704.zip.sha256",
      "decision_state": "quarantine_first"
    },
    {
      "path": "<WORKSPACE_ROOT>/mertformer_5080_native_challenge_builder_v3_logged_20260422_190808",
      "classification": "external_workspace_entry",
      "reason": "Top-level directory outside the active repo root. Keep only if still actively used; otherwise quarantine first.",
      "restore_target": "<WORKSPACE_ROOT>/mertformer_5080_native_challenge_builder_v3_logged_20260422_190808",
      "decision_state": "quarantine_first"
    },
    {
      "path": "<WORKSPACE_ROOT>/mertformer_5080_native_challenge_builder_v3_logged_20260422_190808.zip.sha256",
      "classification": "external_workspace_file",
      "reason": "Top-level file outside the active repo root. Quarantine first instead of deleting in place.",
      "restore_target": "<WORKSPACE_ROOT>/mertformer_5080_native_challenge_builder_v3_logged_20260422_190808.zip.sha256",
      "decision_state": "quarantine_first"
    },
    {
      "path": "<WORKSPACE_ROOT>/mertformer_5080_runner_for_friend_20260420",
      "classification": "external_workspace_entry",
      "reason": "Top-level directory outside the active repo root. Keep only if still actively used; otherwise quarantine first.",
      "restore_target": "<WORKSPACE_ROOT>/mertformer_5080_runner_for_friend_20260420",
      "decision_state": "quarantine_first"
    },
    {
      "path": "<WORKSPACE_ROOT>/mertformer_5080_runner_for_friend_20260420.zip.sha256",
      "classification": "external_workspace_file",
      "reason": "Top-level file outside the active repo root. Quarantine first instead of deleting in place.",
      "restore_target": "<WORKSPACE_ROOT>/mertformer_5080_runner_for_friend_20260420.zip.sha256",
      "decision_state": "quarantine_first"
    }
  ]
}
